iteration	commit	backend	candidate	primary_ratio	target_result	correctness	rss	status	notes
0	9b20d46	all	balanced 12-block baseline	1.000000	stdlib/wasm2go/wazero/cgo captured	backend digest d0eb22c9; all four pass	large and parallel RSS captured	baseline	100ms per sample, 12 process-level samples, CPU0 serial and CPU0-7 parallel
1	ef9aa1d	wazero	reuse per-module match CallWithStack array	0.956900	serial geomean -4.31%; Match/16 -11.69% to -13.47%; Find -8.62%; 64 B and 1 alloc/op removed	wazero root and experimental suites pass; digest unchanged	large median 119.9 MiB vs 119.9 MiB; parallel did not regress	kept	12 balanced A/B samples; Set geomean +0.25% guard noise below 1% threshold
2	4884dab+c0b4f136	wazero	lazy shared bounds-mode capture plus 64-bit safety gate	0.824900	serial geomean -17.51%; generic 16 KiB -25.45%; compile -33.44% to -36.88%; stable parallel scans -20.39% to -25.90%	wazero version/frontend tests and go-re2 root/experimental pass; linux/386 cross-compile passes	final RSS did not regress	kept with tradeoff	Set small -9% to -12%, but Set large +4.67% to +4.74%; exact env-only A/B reproduced the regression
3	1637b0e	wazero	direct Set dispatch through operation-owned module and call stack	0.864100	Set geomean -13.59%; small -23.03% to -27.14%; one alloc and 48 B/op removed	default, cgo, and wazero root/experimental suites pass	no structural memory growth	kept	Set large improves only 0.22% to 0.35%; combined bounds+dispatch remains about 4.3% slower than the bounds-off large Set baseline
4	13f0bfd	wasm2go+cre2	early boolean-match path before submatch storage setup	1.095500	candidate-local wasm2go serial geomean -1.16%, but final isolation found wazero serial geomean +9.55%, generic scans +29.54% to +39.51%, and realistic match +19.24%	default, wazero, and cgo root suites pass; Wasm regenerated with pinned toolchain	artifact size +81 bytes	reverted	initial wazero/cgo A/B was inconclusive during host frequency bimodality; final pre-boolean vs post-boolean 12-block isolation exposed the cross-backend interaction, so reverted by 7077d25
5	2090077	wasm2go	operation-owned child module with persistent geometric scratch	0.891400	serial geomean -10.86%; tiny Match -31.75% to -36.38%; Find -20.86%; stable parallel short Match -66% to -69%; Set geomean -5.68%	default root and experimental suites pass	large median unchanged at 71.7 MiB; parallel median did not regress	kept	large copy- or guest-dominated scans change by less than 0.5%; compile path intentionally unchanged
6	2410da23+971d51f8	wazero	hoist immutable shared-memory base in frontend SSA	1.000000	serial geomean -0.00%; Set +0.01%; stable parallel -0.11%	frontend, wazevo, wasm, and version suites pass	no structural RSS change expected	reverted	12 balanced A/B samples; all primary series within 0.5% noise, so frontend complexity did not earn its keep; reverted by 232f555e+3087f85f
